{
  "id": "paneforge-binding-controller",
  "title": "Controller fixture",
  "role": "worker",
  "sessionId": "session-controller-fixture",
  "projectPath": "D:/fixture/project",
  "cliTool": "codex",
  "status": "running",
  "progress": 70,
  "sortOrder": 0,
  "metadata": {
    "kept": true,
    "owner": {
      "kind": "fixture"
    }
  },
  "createdAt": "2026-08-05T10:00:00Z",
  "updatedAt": "2026-08-05T10:30:00Z"
}
