{
  "id": "paneforge-binding-001",
  "title": "Adapter fixture",
  "role": "worker",
  "sessionId": "session-001",
  "projectPath": "PROJECT_PATH",
  "cliTool": "codex",
  "status": "completed",
  "progress": 100,
  "completionSummary": "Worker reported completion without a proof bundle.",
  "exitCode": 0,
  "sortOrder": 0,
  "metadata": {
    "kept": true
  },
  "createdAt": "2026-08-05T20:00:00+08:00",
  "updatedAt": "2026-08-05T20:30:00+08:00"
}
